"MKC5VHUQ","journalArticle","2015","Konstan, Joseph A.; Walker, J. D.; Brooks, D. Christopher; Brown, Keith; Ekstrand, Michael D.","Teaching Recommender Systems at Large Scale: Evaluation and Lessons Learned from a Hybrid MOOC","ACM Trans. Comput.-Hum. Interact.","","1073-0516","10.1145/2728171","http://doi.acm.org/10.1145/2728171","","2015-04","2017-09-14 16:02:49","2017-09-14 16:02:49","2016-09-03 20:38:02","10:1–10:23","","2","22","","","Teaching Recommender Systems at Large Scale","","","","","","","","","","","","ACM Digital Library","","","","","","","learning assessment; Massively Online Open Course (MOOC)","","","","","","","","","","","","","","","","","","","","","","","","","","","","","","","","","","","","","","","","","","","","","",""
"AZIL8YWE","book","2015","Matsuda, Noboru; Furukawa, Tadanobu; Bier, Norman; Faloutsos, Christos","Machine Beats Experts: Automatic Discovery of Skill Models for Data-Driven Online Course Refinement","","","","","http://eric.ed.gov/?id=ED560513","How can we automatically determine which skills must be mastered for the successful completion of an online course? Large-scale online courses (e.g., MOOCs) often contain a broad range of contents frequently intended to be a semester's worth of materials; this breadth often makes it difficult to articulate an accurate set of skills and knowledge (i.e., a skill model, or the QMatrix). We have developed an innovative method to discover skill models from the data of online courses. Our method assumes that online courses have a pre-defined skill map for which skills are associated with formative assessment items embedded throughout the online course. Our method carefully exploits correlations between various parts of student performance, as well as in the text of assessment items, to build a superior statistical model that even outperforms human experts. To evaluate our method, we compare our method with existing methods (LFA) and human engineered skill models on three Open Learning Initiative (OLI) courses at Carnegie Mellon University. The results show that (1) our method outperforms human-engineered skill models, (2) skill models discovered by our method are interpretable, and (3) our method is remarkably faster than existing methods. These results suggest that our method provides a significant contribution to the evidence-based, iterative refinement of online courses with a promising scalability. [For complete proceedings, see ED560503.]","2015-06","2017-09-14 16:02:49","2017-09-14 16:02:49","2016-09-03 20:48:57","","","","","","","Machine Beats Experts","","","","","International Educational Data Mining Society","","en","","","","","ERIC","","","","","http://eric.ed.gov/?id=ED560513","","data; Automation; Comparative Analysis; Correlation; Formative Evaluation; models; Online Courses; Skills","","","","","","","","","","","","","","","","","","","","","","","","","","","","","","","","","","","","","","","","","","","","","",""
"4VB4MQ5D","bookSection","2016","Hanneman, R.A.; Riddle, M.","Chapter 1: Social Network Data","Introduction to Social Network Methods","","","","http://faculty.ucr.edu/~hanneman/nettext/C1_Social_Network_Data.html","","2016-01-18","2017-09-14 16:02:49","2017-09-14 16:02:49","2016-01-18 20:17:24","","","","","","","","","","","","","","","","","","","","","","","","http://faculty.ucr.edu/~hanneman/nettext/C1_Social_Network_Data.html","","","","","","","","","","","","","","","","","","","","","","","","","","","","","","","","","","","","","","","","","","","","","","","",""
"Z3ASTW7A","bookSection","2017","Klerkx, Joris; Verbert, Katrien; Duval, Erik","Learning Analytics Dashboards","The Handbook of Learning Analytics","978-0-9952408-0-3","","","www.solaresearch.org","","2017","2017-09-14 16:02:49","2017-09-14 16:02:49","","","","","","","","","","","","","","Vancouver, BC, Canada","EN","","","","","","","","","","","","","","","","","","","","","","","","","","","","","","","","1","","","","","","","","","","","","","","","","","","","","","","","","","",""
"FM6PS8LS","bookSection","2017","Bergner, Yoav","Measurement and its Uses in Learning Analytics","The Handbook of Learning Analytics","978-0-9952408-0-3","","","http://solaresearch.org/hla-17/hla17-chapter1","Psychological measurement is a process for making warranted claims about states of mind. As such, it typically comprises the following: de ning a construct; specifying a measurement model and (developing) a reliable instrument; analyzing and accounting for various sources of error (including operator error); and framing a valid argument for particular uses of the outcome. Measurement of latent variables is, after all, a noisy endeavor that can neverthe- less have high-stakes consequences for individuals and groups. This chapter is intended to serve as an introduction to educational and psychological measurement for practitioners in learning analytics and educational data mining. It is organized thematically rather than historically, from more conceptual material about constructs, instruments, and sources of measurement error toward increasing technical detail about particular measurement models and their uses. Some of the philosophical differences between explanatory and predictive modelling are explored toward the end.","2017","2017-09-14 16:02:49","2017-09-14 16:02:49","","34-48","","","","","","","","","","","Society for Learning Analytics Research (SoLAR)","Alberta, Canada","","","","","","","","","; <p>ITR: Item Response Theory</p> <p>modelling individual person-item interactions</p> <p>purpose: to describe the items by item parameters and the examinees by examinee parameters in such a way that we can predict probabilitstically the response of any examinee to any item, even if similar examinees have never taken similar items before.</p>","","","","","Lang, Charles; Siemens, George; Wise, Alyssa Friend; Gaševic, Dragan","","","","","","","","","","","","","","","","","","","1","","","","","","","","","","","","","","","","","","","","","","","","","",""
"KN47IKCH","bookSection","2017","Brooks, Christopher; Thompson, Craig","Predictive Modelling in Teaching and Learning","The Handbook of Learning Analytics","978-0-9952408-0-3","","","http://solaresearch.org/hla-17/hla17-chapter1","This article describes the process, practice, and challenges of using predictive modelling in teaching and learning. In both the  elds of educational data mining (EDM) and learning analytics (LA) predictive modelling has become a core practice of researchers, largely with a focus on predicting student success as operationalized by academic achievement. In this chapter, we provide a general overview of considerations when using predictive modelling, the steps that an educational data scientist must consider when engaging in the process, and a brief overview of the most popular techniques in the  eld.","2017","2017-09-14 16:02:50","2017-09-14 16:02:50","","61-68","","","","","","","","","","","Society for Learning Analytics Research (SoLAR)","Alberta, Canada","","","","","","","","","","","","","","Lang, Charles; Siemens, George; Wise, Alyssa Friend; Gaševic, Dragan","","","","","","","","","","","","","","","","","","","1","","","","","","","","","","","","","","","","","","","","","","","","","",""
"EWSXKF6I","bookSection","2017","Prinsloo, P; Slade, S","Ethics and Learning Analytics: Charting the (Un)Charted","The Handbook of Learning Analytics","978-0-9952408-0-3","","","https://solaresearch.org/hla-17/hla17-chapter4/","","2017-03","2017-09-14 16:02:50","2017-09-14 16:02:50","","49-57","","","","","","","","","","","Society for Learning Analytics Research","Vancouver, BC","EN","","","","","","","","<p>Privacy</p> <p>The debate surrounding privacy and surveillance of students information is heated. There is no agreement on to what extent should  privacy be protected. Personally speaking, I believe that more power, more responsibilities. Data is weapon, with which man with kindness can harness wild grass while man with selfishness can make a profit. I personally believe that data analyst should stick to these moral code. Endowed with power and access, restrictions and responsibilities come with the territory. However, moral is not a solid means to guard against fortune-seekers. But laws and contracts are.</p> <p>On the other hand, laws and contracts should not only set limits on the practitioners but also should set the line between the public and the practitioners so that data wranglers wanting to explore data and make good use data can ""freely"" apply what they have learned to schools and families rather than hesitate.</p> <p> </p>","","","","","","","","","","","","","","","","","","","","","","","","1","","","","","","","","","","","","","","","","","","","","","","","","","",""
"HLQ99P36","bookSection","2017","Liu, R; Koedinger, K","Going Beyond Better Data Prediction to Create Explanatory Models of Educational Data","The Handbook of Learning Analytics","978-0-9952408-0-3","","","https://solaresearch.org/hla-17/hla17-chapter6/","","2017-03","2017-09-14 16:02:50","2017-09-14 16:02:50","","69-76","","","","","","","","","","","Society for Learning Analytics Research","Vancouver, BC","EN","","","","","","","","","","","","","","","","","","","","","","","","","","","","","","","","1","","","","","","","","","","","","","","","","","","","","","","","","","",""
"YL3Q69MB","journalArticle","2011","Gelman, A; Niemi, J","Statistical graphics: making information clear – and beautiful","Significance","","","","","","2011-09","2017-09-14 16:02:50","2017-09-14 16:02:50","","134-136","","","","","","","","","","","","","","","","","","","","","","","","","","","","","","","","","","","","","","","","","","","","","","","","","","","","","","","","","","","","","","","","","","","","","","",""
"YWQ2LQL6","journalArticle","1984","Wainer, H","How to display data badly","The American Statistician","","","","","","1984","2017-09-14 16:02:50","2017-09-14 16:02:50","","137-147","","2","38","","","","","","","","","","","","","","","","","","","","","","","","","","","","","","","","","","","","","","","","","","","","","","","","","","","","","","","","","","","","","","","","","","","",""
"M5HTLMJE","journalArticle","2012","Gelman, A; Unwin, A","Infovis and Statistical Graphics: Different Goals, Different Looks (with discussion)","","","","","","","2012","2017-09-14 16:02:50","2017-09-14 16:02:50","","","","","","","","","","","","","","","","","","","","","","","","","","","","","","","","","","","","","","","","","","","","","","","","","","","","","","","","","","","","","","","","","","","","","","","","",""
"4Z3DUFLE","blogPost","2014","Fung, K","Junkcharts Trifecta Checkup: The Definitive Guide","Junkcharts","","","","http://junkcharts.typepad.com/junk_charts/junk-charts-trifecta-checkup-the-definitive-guide.html","","2014","2017-09-14 16:02:50","2017-09-14 16:02:50","","","","","","","","","","","","","","","","","Blog","","","","","","","","","","","","","","","","","","","","","","","","","","","","","","","","","","","","","","","","","","","","","","","","","","","","","","","",""