"NZVXT95B","journalArticle","2012","Greller, Wolfgang; Drachsler, Hendrik","Translating Learning into Numbers: A Generic Framework for Learning Analytics","Journal of Educational Technology & Society","","1176-3647","","http://www.jstor.org/stable/jeductechsoci.15.3.42","ABSTRACT With the increase in available educational data, it is expected that Learning Analytics will become a powerful means to inform and support learners, teachers and their institutions in better understanding and predicting personal learning needs and performance. However, the processes and requirements behind the beneficial application of Learning and Knowledge Analytics as well as the consequences for learning and teaching are still far from being understood. In this paper, we explore the key dimensions of Learning Analytics (LA), the critical problem zones, and some potential dangers to the beneficial exploitation of educational data. We propose and discuss a generic design framework that can act as a useful guide for setting up Learning Analytics services in support of educational practice and learner guidance, in quality assurance, curriculum development, and in improving teacher effectiveness and efficiency. Furthermore, the presented article intends to inform about soft barriers and limitations of Learning Analytics. We identify the required skills and competences that make meaningful use of Learning Analytics data possible to overcome gaps in interpretation literacy among educational stakeholders. We also discuss privacy and ethical issues and suggest ways in which these issues can be addressed through policy guidelines and best practice examples.","2012","2017-09-19 15:46:17","2017-09-19 15:46:17","2017-09-19 15:46:17","42-57","","3","15","","","Translating Learning into Numbers","","","","","","","","","","","","JSTOR","","","<p>Key Notes:</p> <p>""<span style=""font-size: 10.000000pt; font-family: 'TimesNewRomanPSMT';"">The proliferation of interactive learning environments, learning management systems (LMS), intelligent tutoring systems, e-portfolio systems, and personal learning environments (PLE) in all sectors of education produces vast amounts of tracking data. But, although these e-learning environments store user data automatically, exploitation of the data for learning and teaching is still very limited. These educational datasets offer unused opportunities for the evaluation of learning theories, learner feedback and support, early warning systems, learning technology, and the development of future learning applications. This leads to the importance of Learning Analytics (LA) being increasingly recognised by governments, educators, funding agencies, research institutes, and software providers.</span>""""</p> <p> </p> <p>""<span style=""font-size: 10.000000pt; font-family: 'TimesNewRomanPSMT';"">By soft issues we mean challenges that depend on assumptions being made about humans or the society in general, e.g., competences or ethics. They are opposed by the hard challenges of the fact-based world of data and algorithm"" </span></p> <p> </p> <p><span style=""font-size: 10.000000pt; font-family: 'TimesNewRomanPSMT';"">""Apart from support for reflective practice, LA can also be used for predicting and modelling learner activities (Siemens, 2011; Verbert et al., 2011). This can lead to earlier intervention (e.g., to prevent drop-out), or to adaptive services and curricula.</span>""</p> <p> </p> <p>""<span style=""font-size: 10.000000pt; font-family: 'TimesNewRomanPSMT';"">With respect to pedagogic theories, we would like to argue that LA does neither support nor ignore specific pedagogic theories, and as an abstract concept is pedagogically neutral. Indeed, we are of the opinion that LA can be used to evaluate different pedagogic strategies and their effects on learning and teaching through the analysis of learner data.</span>""</p> <p> </p> <p>""<span style=""font-size: 10.000000pt; font-family: 'TimesNewRomanPSMT';"">LA strongly relies on data about learners and one of the major challenges LA researchers are facing is the availability of publicly available datasets to evaluate their LA methods. Most of the data produced in institutions is protected, and the protection of student data and created learning artefacts is a high priority for IT services departments.</span>""</p> <p> </p> <p>""<span style=""font-size: 10.000000pt; font-family: 'TimesNewRomanPSMT';"">Like in related research domains, LA datasets create a new set of challenges for research and practice. These include: </span></p> <div class=""page"" title=""Page 8""> <div class=""layoutArea""> <div class=""column""> <ul style=""list-style-type: none;""> <li> <p><span style=""font-size: 10.000000pt; font-family: 'SymbolMT';"">􏰀  </span><span style=""font-size: 10.000000pt; font-family: 'TimesNewRomanPSMT';"">A lack of common dataset formats like the suggested one from the CEN/ISSS PT social data group (cf. CAM Schema at: https://sites.google.com/site/camschema/home; and Wolpers et al., 2007). </span></p> </li> <li> <p><span style=""font-size: 10.000000pt; font-family: 'SymbolMT';"">􏰀  </span><span style=""font-size: 10.000000pt; font-family: 'TimesNewRomanPSMT';"">The need for version control and a common reference system to distinguish and point to different datasets. </span></p> </li> <li> <p><span style=""font-size: 10.000000pt; font-family: 'SymbolMT';"">􏰀  </span><span style=""font-size: 10.000000pt; font-family: 'TimesNewRomanPSMT';"">Methods to anonymise and pre-process data according to privacy and legal protection rights (Drachsler et al., 2010). </span></p> </li> <li> <p><span style=""font-size: 10.000000pt; font-family: 'SymbolMT';"">􏰀  </span><span style=""font-size: 10.000000pt; font-family: 'TimesNewRomanPSMT';"">A standardised documentation of datasets so that others can make proper use of it like that promoted by the data-seal-of-approval initiative (cf. http://www.datasealofapproval.org). </span></p> </li> <li> <p><span style=""font-size: 10.000000pt; font-family: 'SymbolMT';"">􏰀  </span><span style=""font-size: 10.000000pt; font-family: 'TimesNewRomanPSMT';"">Data policies (licences) that regulate how users can use and share certain datasets. For instance, the Creative </span></p> <p><span style=""font-size: 10.000000pt; font-family: 'TimesNewRomanPSMT';"">Commons licensing rights could be considered as a standard way to grant permissions to datasets. DataCite (Brase, 2009) is an organization that enables to register research datasets and to assign licensing rights to them, so that the datasets can be referenced similar to academic articles.</span></p> <p style=""text-align: left;""><span style=""font-size: 10.000000pt; font-family: 'TimesNewRomanPSMT';"">From a technical point of view, idealised datasets probably remain the biggest challenge for analytics. This is to say that the assumption that datasets consist of context-free, meaningful and </span><span style=""font-size: 10.000000pt; font-family: 'TimesNewRomanPS'; font-style: italic;"">only </span><span style=""font-size: 10.000000pt; font-family: 'TimesNewRomanPSMT';"">meaningful data, is highly optimistic. In most natural settings, users “pollute” databases by producing erroneous or incomplete datasets.</span>""</p> </li> </ul> <p>""<span style=""font-size: 10.000000pt; font-family: 'TimesNewRomanPSMT';"">Similarly, data collection often leads to “enmeshed identities” being used for analytics and prediction. A dataset cannot typically distinguish between a single individual and a shared presence in the learning space (group work on a single device). Students who often work together with others on shared devices (laptops, smartphone, lab space, etc.) produce enmeshed fingerprints in their educational data.</span>""</p> <p> </p> <p>""<span style=""font-size: 10.000000pt; font-family: 'TimesNewRomanPSMT';"">Additionally, from a pedagogic perspective, it remains an on-going challenge to formulate indicators from the available datasets that bear relevance for the evaluation of the learning process. The selection of specific data and their weighting (under the methods applied in the “instruments” dimension) against the real behaviour of students is of greatest importance, as is the process of relating behaviour pattern data to cognitive developments.</span>""</p> <p> </p> <p>""<span style=""font-size: 10.000000pt; font-family: 'TimesNewRomanPSMT';"">Further research on LA can contribute to decrease</span> <span style=""font-size: 10.000000pt; font-family: 'TimesNewRomanPSMT';"">the drop-out rate by developing e.g., a </span><span style=""font-size: 10.000000pt; font-family: 'TimesNewRomanPS'; font-style: italic;"">Drop-out Analyser </span><span style=""font-size: 10.000000pt; font-family: 'TimesNewRomanPSMT';"">that notifies the teacher of a course in time which students are in danger of falling behind or dropping out. This could be done by using LMS datasets and train a certain information retrieval technology (e.g., a Bayesian classifier) on the datasets to learn behavioural patterns of students that dropped out.</span>""</p> <p> </p> <p>""<span style=""font-size: 10.000000pt; font-family: 'TimesNewRomanPSMT';"">Many different kinds of constraints can limit the beneficial application of LA processes, some being “softer” than others. It has been suggested to us to identify them as ethical, legal, and social constraints, but also to feature organisational, managerial, and process constraints. This we find a useful subdivision of external limitations, but other divisions look equally logical. In the abstraction of the diagram above (cf. Figure 1), we propose the preliminary distinction of </span><span style=""font-size: 10.000000pt; font-family: 'TimesNewRomanPS'; font-style: italic;"">conventions</span><span style=""font-size: 10.000000pt; font-family: 'TimesNewRomanPSMT';"">, under which we count ethics, personal privacy, and similar socially motivated limitations, and, </span><span style=""font-size: 10.000000pt; font-family: 'TimesNewRomanPS'; font-style: italic;"">norms </span><span style=""font-size: 10.000000pt; font-family: 'TimesNewRomanPSMT';"">that are restricted by laws or specific mandated policies or standards.""</span></p> <p> </p> <p><span style=""font-size: 10.000000pt; font-family: 'TimesNewRomanPSMT';"">""On institutional level, educational and student data was traditionally handled separately, and is legally something of a blind spot. Registration data was kept and maintained by registry staff, IT data by IT staff, and learning data by academic staff. To use LA to its full potential, integration of available institutional datasets needs to happen.</span>""</p> <p> </p> <p>""<span style=""font-size: 10.000000pt; font-family: 'TimesNewRomanPSMT';"">Another ethical consideration is the acceptance of divergence in the data constituency (AoIR, 2002). We already touched upon the danger that the result of algorithmic analysis, consequent policies and exercised pressures may aim at uniformity and at mainstreaming learning and teaching processes, thereby greatly harming creative processes and innovation that diverge from the statistical mean.</span>""</p> <p> </p> <p>""<span style=""font-size: 10.000000pt; font-family: 'TimesNewRomanPSMT';"">In order to make LA an effective tool for educational practice, it is important to recognise that LA ends with the presentation of algorithmically attained results that require interpretation (Reffay &amp; Chanier, 2003; Mazza &amp; Milani, 2005). There are innumerable ways to present and to interpret data and base consecutive decisions and actions on it, but only some of them will lead to benefits and to improved learning""</span></p> <p><span style=""font-size: 10.000000pt; font-family: 'TimesNewRomanPSMT';"">""LA has been effectively used for behaviourist-instructivist style approaches (but see the critical reflection by Pardo &amp; Kloos, 2011), but there is as yet little evidence for the support of constructivist approaches to learning (Duffy &amp; Cunningham, 2001), where learning is seen as an active cognitive process in which learners construct their own concepts of the world around them. In LA, the latter is mostly inferred indirectly, by relating grades of learning outcomes with activities during the learning process (Dawson, 2012). In these correlations, it emerges that active students get better results.</span>""</p> <p> </p> <p>""<span style=""font-size: 10.000000pt; font-family: 'TimesNewRomanPSMT';"">In our model, LA can work in support of a multitude of pedagogic strategies and learning activities as manifested and represented by the available data. This means we can only see pedagogies through the data. Because of this, we do not include them as part of the analytics process (Figure 1) but as </span><span style=""font-size: 10.000000pt; font-family: 'TimesNewRomanPS'; font-style: italic;"">implicitly </span><span style=""font-size: 10.000000pt; font-family: 'TimesNewRomanPSMT';"">contained in the input datasets that encapsulate the pedagogic behaviour of users.</span>""</p> <p> </p> <p>""<span style=""font-size: 10.000000pt; font-family: 'TimesNewRomanPSMT';"">Additionally, pedagogy can be </span><span style=""font-size: 10.000000pt; font-family: 'TimesNewRomanPS'; font-style: italic;"">explicitly </span><span style=""font-size: 10.000000pt; font-family: 'TimesNewRomanPSMT';"">addressed in the goals and objectives that the LA designer sets (“objectives” dimension). The LA method (“instruments” dimension) will determine the outcome of the analysis and together with the interpretation applied may lead to a large variety of options for consequences and interventions"" </span></p> <p> </p> <p><span style=""font-size: 10.000000pt; font-family: 'TimesNewRomanPSMT';"">""It is therefore our conviction that only the consideration of all six dimensions in the design process can lead to optimal exploitation of LA. Additionally, substantial work on new ethical guidance, data curation, and ownership needs to happen at universities and in legislation to reduce the risks connected to the application of LA and to protect the data subject, usually the learner.</span>""</p> <p> </p> <p>""<span style=""font-size: 10.000000pt; font-family: 'TimesNewRomanPSMT';"">In its most optimistic outlook, learners will be provided with personal information about their current needs, while, at the same time, the educational system will be evolved from a “one- size-fits-all” approach into a highly personal competence-driven educational experience. But this view is not without flaws, because of the real dangers that the extended and organised collection of learner data may not so much bring added benefits to the individual, but instead provides a tool for HEIs, companies, or governments to increase manipulative control over students, employees, and citizens, thereby abusing LA as a means to reinforce segregation, peer pressure, and conformism rather than to help construct a needs-driven learning society. We therefore believe that it will be of critical importance for its acceptance that the development of LA takes a bottom-up approach focused on the interests of the learners as the main driving force.</span>""</p> </div> </div> </div>","","","","","","","","","","","","","","","","","","","","","","","","","","","","","","","","","","","","","","","","","","","","","","","","","",""
"VZA76C8L","webpage","2017","","Chapter 4: Handbook of Learning Analytics","Society for Learning Analytics Research (SoLAR)","","","","https://solaresearch.org/hla-17/hla17-chapter4/","Handbook of Learning Analytics First Edition Ethics and Learning Analytics: Charting the (Un)Charted Paul Prinsloo & Sharon Slade Download Chapter Download Book Abstract As the field of learnin…","2017-05-10","2017-09-19 15:59:34","2017-12-17 21:56:17","2017-09-19 15:59:34","","","","","","","","","","","","","","","","","","","","","","<p>Key Notes:</p> <p>""<span style=""font-size: 9.000000pt; font-family: 'Lora';"">Tools can be used in many ways, and should not</span>""</p> <p>""<span style=""font-size: 9.000000pt; font-family: 'Lora';"">Learning analytics, as a new form of assessment instrument, have potential to support current educational practices, or to challenge them and reshape education; considering their theoretic positioning is important in understanding the kind of education""</span></p> <p><span style=""font-size: 9.000000pt; font-family: 'Lora';"">""This question regards the desire for analytic insights at multiple levels of a system, and the ability of indi- vidual analytic approaches (including their outputs in various forms, such as dashboards) to support the following: 1) individual students in developing their learning; 2) educators in developing their own practice and in targeting their support at individual student needs; and 3) administrators in understanding"" </span></p> <p><span style=""font-size: 9.000000pt; font-family: 'Lora';"">""First, analytics that require particular forms of technology or participation may create new divides between student cohorts, or - entrench existing divides. Second, there is an ethical concern regarding the use of student data by not given, where no direct learning gain is directed to those students.""</span></p>","/Users/blakeschool/Zotero/storage/EM82INJT/hla17-chapter4.html","","","","","","","","","","","","","","","","","","","","","","","","","","","","","","","","","","","","","","","","","","","","","","","","",""
"87MG69NQ","webpage","2017","","Handbook of Learning Analytics – First edition","Society for Learning Analytics Research (SoLAR)","","","","https://solaresearch.org/hla-17/","2017 The Handbook of Learning Analytics Editors: Charles Lang, George Siemens, Alyssa Wise, Dragan Gašević ISBN: 978-0-9952408-0-3 DOI: 10.18608/hla17 Download Book Order printed copy   The Ha…","2017-02-25","2017-09-19 15:59:47","2017-09-19 15:59:47","2017-09-19 15:59:47","","","","","","","","","","","","","","","","","","","","","","","/Users/blakeschool/Zotero/storage/RN9G6XAD/hla-17.html","","","","","","","","","","","","","","","","","","","","","","","","","","","","","","","","","","","","","","","","","","","","","","","","",""
"4ZGQP9QX","webpage","2017","","Chapter 1 Handbook of Learning Analytics","Society for Learning Analytics Research (SoLAR)","","","","https://solaresearch.org/hla-17/hla17-chapter1/","Handbook of Learning Analytics First Edition Theory and Learning Analytics Simon Knight & Simon Buckingham Shum Download Book Download Chapter Download Chapter Download Book Abstract The challe…","2017-03-25","2017-09-26 17:01:03","2017-12-17 21:56:07","2017-09-26 17:01:03","","","","","","","","","","","","","","","","","","","","","","<p>Key Notes:</p> <p> ""<span style=""font-size: 9.000000pt; font-family: 'Lora';"">by design — or else by accident — the use of a learning analytics tool is always aligned with </span><span style=""font-size: 9.000000pt; font-family: 'Lora'; font-style: italic;"">assessment regimes</span><span style=""font-size: 9.000000pt; font-family: 'Lora';"">, which are in turn grounded in </span><span style=""font-size: 9.000000pt; font-family: 'Lora'; font-style: italic;"">epistemological assumptions </span><span style=""font-size: 9.000000pt; font-family: 'Lora';"">and </span><span style=""font-size: 9.000000pt; font-family: 'Lora'; font-style: italic;"">pedagogical practices</span>""</p> <p>"" That is the question of epistemology: it concerns the nature of the constructs, why they kind required for a claim of knowledge to be made""</p> <p>""<span style=""font-size: 9.000000pt; font-family: 'Lora';"">This question regards the desire for analytic insights at multiple levels of a system, and the ability of individual analytic approaches (including their outputs in various forms, such as dashboards) to support the following: 1) individual students in developing their learning; 2) educators in developing their own practice and in targeting their support at individual student needs; and 3) administrators in understanding</span>""</p>","","","","","","","","","","","","","","","","","","","","","","","","","","","","","","","","","","","","","","","","","","","","","","","","","",""
"WSWHKFXK","webpage","","","How to Display Data Badly","","","","","http://rci.rutgers.edu/%7Eroos/Courses/grstat502/wainer.pdf","","","2017-10-09 23:15:47","2017-12-17 22:03:44","2017-10-09 23:12:23","","","","","","","","","","","","","","","","","","","","","","<p>Key Notes:</p> <p>Good displays of data show data, show data accurately, and show data clearly.</p> <p> </p> <p>Bad data displays: 1) show as few data as possible</p> <p>2) Hide what data you do show</p> <p>3) Ignore visual metaphor</p> <p>4) Only order matters</p> <p>5) Graph data out of context</p> <p>6) Change scales in mid-axis</p> <p>7) Emphasize trivial and ignore the important</p> <p>8) Jiggle the baseline</p> <p>9) Austra first (alphabetically ordering)</p> <p style=""text-align: left;"">10) Label illegibly, incompletely, incorrectly, and ambiguously</p> <p style=""text-align: left;"">11) More decimal places and more dimensions</p>","/Users/blakeschool/Zotero/storage/R72H3KLT/wainer.pdf","","","","","","","","","","","","","","","","","","","","","","","","","","","","","","","","","","","","","","","","","","","","","","","","",""
"CRG9D27Z","webpage","","","Statistical graphics: making information clear – and beautiful, Significance","","","","","http://www.stat.columbia.edu/%7Egelman/research/published/niemi.pdf","","","2017-10-09 23:34:58","2017-12-17 22:04:18","2017-10-09 23:34:46","","","","","","","","","","","","","","","","","","","","","","<p>Key Notes:</p> <p>Information visuals = infovis</p> <p>Avoid distracting elements. Use informative color to visually associate  elements. Keep the figure simple (and  therefore interpretable)</p> <p>Keep the  x - and  y -axes on the same scale.  Eliminate repetitive information. Maintain consistency across plots.</p>","/Users/blakeschool/Zotero/storage/2MXMTVVJ/niemi.pdf","","","","","","","","","","","","","","","","","","","","","","","","","","","","","","","","","","","","","","","","","","","","","","","","",""
