"9HNTIJDV","webpage","","","Analyzing the Longitudinal K-12 Gradin g Histories of Entire Cohorts of  Students: Grades, Data Driven Decision Making, Dropping Out and  Hierarchical Cluster Analysis","","","","","http://pareonline.net/pdf/v15n7.pdf","","","2017-10-25 00:48:58","2017-12-17 22:00:44","2017-10-24 17:00:07","","","","","","","","","","","","","","","","","","","","","","<p>Key Notes:</p> <p>Indeed, while  administrators have indicated that they privilege standardized test scores over other forms of data (Guskey,  2007),  little  criterion  validity  has  been  shown   for test scores as they relate  to overall student school or  life  outcomes  (Rumberger  &amp;  Palardy,  2005),  whereas   teacher-assigned grades have a  long history of predicting  overall   student   outcomes, such as graduating or  dropping out (Bowers, 2010).</p> <p> The  goal  should  be  to  interrupt  a   decline  in  achievement  early,  before  it  results  in  future   course failure, especially if an early but small decline is  predictive of major future challenges with school years  later </p> <p> HCA  also  provides a means  to  draw  what  is   known  as  a  cluster tree, or a dendrogram  (“dendro”  from the Greek meaning “root s or tree”).</p> <p>Thus,  the  central  aim  of  this  study  is  to  adapt   hierarchical  cluster  analysis  and  heatmaps  for  use  with   teacher assigned grades for data driven decision-making.  The  method  will  be  tested  and  demonstrated  with  a   small sample of data, and the study will explore what the  analysis and visualization method can and cannot do for  3DM in schools. The research question of interest here  is  that  as  just  one  example  of  the  usefulness  of  the   method  for  3DM,  to  what  extent  do  student  grades   cluster  through  HCA  into  patterns  that  identify  which   students are most at risk of dropping out of school.</p> <p>Supervised  clustering  begins  with  a  defined  set  of  assumptions about the categorization of the data, while  unsupervised   clustering   assumes   nothing   about   the    categorization and is designed to statistically discover the  underlying    structure    patterns within  the dataset (Kohonen, 1997), a procedure well suited to discovering  the underlying patterns within  student data in education.</p> <p>For  cluster  analysis  in   fields  such  as  the  natural  sciences,  it  has  become   standard to pattern analyze large sets of data and display  both a heatmap together with a dendrogram to visualize  the  patterns  within  the  data   and  determine  if  specific   patterns  align  with  overall  participant  outcomes</p> <p>student   grade   patterns   are   somewhat  unstable  prior  to  grade  four.  However,  the  period between grade 4 and grade 8 seem s to be critical in terms  of   grade patterns when examining overall student  performance, such as dropout.</p> <p>Much  like  a  medical  x-ray,  the  clustergram   provides  a  unique  way  to  “look  inside”  each  student’s   entire history of achievemen t, and examine that history  in context with other students who have performed in a  similar manner through pattern analysis. The interpretation  of  these  data  patterns  for  3DM  is  then   aided  through  this  type  of  pattern  analysis,  and  helps   point    to    possible areas and timing for future interventions. </p>","/Users/blakeschool/Zotero/storage/AC4G84V4/v15n7.pdf","","","","","","","","","","","","","","","","","","","","","","","","","","","","","","","","","","","","","","","","","","","","","","","","",""
"5V73N6TL","videoRecording","","ColumbiaLearn","Big Data in Education 7.1 Clustering","","","","","https://www.youtube.com/watch?v=mgXm3AwLxP8&feature=youtu.be","","","2017-10-25 00:49:27","2017-10-25 00:49:27","2017-10-25 00:49:27","","","","","","","","","","","","","","","","","","","YouTube","","","<p>Key Notes:</p> <p>Want large data set for clustering</p> <p>Move centroids around after picking them until they stop moving around aka convergence</p>","","","","","","","","","","","","","","","","","","","","","","","","","820 seconds","","","","","","","","","","","","","","","","","","","","","","","","",""
"IY9KN6GB","videoRecording","","ColumbiaLearn","Big Data in Education 7.2 Validation and Selection","","","","","https://www.youtube.com/watch?v=B9dvJYwBfmk&feature=youtu.be","","","2017-10-25 01:00:37","2017-10-25 01:00:37","2017-10-25 01:00:37","","","","","","","","","","","","","","","","","","","YouTube","","","<p>Key Notes:</p> <p>Distortion = mean squared deviation</p> <p>More clusters = smaller distortion</p>","","","","","","","","","","","","","","","","","","","","","","","","","322 seconds","","","","","","","","","","","","","","","","","","","","","","","","",""
"TS5MYLP8","journalArticle","1976","Bland, R. D.; Clarke, T. L.; Harden, L. B.","Rapid infusion of sodium bicarbonate and albumin into high-risk premature infants soon after birth: a controlled, prospective trial","American Journal of Obstetrics and Gynecology","","0002-9378","","","We conducted a controlled, prospective trial to evaluate the effectiveness of rapidly infusing sodium bicarbonate (NaHCO3) and salt-poor albumin into high-risk, premature infants in the first 2 hours of life. Fifty-three infants, randomized into one of four treatment groups, received 8 ml. per kilogram of a solution containing either (A) glucose in water, (B) salt-poor albumin, (C) NaHCO3, or (D) a combination of albumin and NaHCO3. After the initial infusion, the babies received no colloid or alkali solutions until 4 hours of age. We managed them supportively with warmth, appropriate oxygen administration, isotonic fluid infusion, and close monitoring. Among the infants who received alkali, 14 of 26 acquired the respiratory distress syndrome (RDS), 11 died, and four had intracranial hemorrhage. Among babies who received no alkali, RDS occurred in 11 of 27, 5 died, and none had intracranial hemorrhage. These results do not support the common practice of rapidly infusing NaHCO3 into high-risk, premature infants, and they suggest that the early management of such infants needs renewed critical evaluation.","1976-02-01","2017-10-30 01:59:56","2017-10-30 01:59:56","","263-267","","3","124","","Am. J. Obstet. Gynecol.","Rapid infusion of sodium bicarbonate and albumin into high-risk premature infants soon after birth","","","","","","","eng","","","","","PubMed","","PMID: 2013","","","http://www.ncbi.nlm.nih.gov/pubmed/2013","","Acidosis; Albumins; Bicarbonates; Carbon Dioxide; Cerebral Hemorrhage; Female; Hawaii; Humans; Hydrogen-Ion Concentration; Infant, Newborn; Infant, Premature, Diseases; Infusions, Parenteral; Male; Prospective Studies; Respiratory Distress Syndrome, Newborn; Sodium; Time Factors","","","","","","","","","","","","","","","","","","","","","","","","","","","","","","","","","","","","","","","","","","","","","",""
"3EJTHS3C","journalArticle","1975","Chow, Y. W.; Pietranico, R.; Mukerji, A.","Studies of oxygen binding energy to hemoglobin molecule","Biochemical and Biophysical Research Communications","","0006-291X","","","","1975-10-27","2017-10-30 01:59:57","2017-10-30 01:59:57","","1424-1431","","4","66","","Biochem. Biophys. Res. Commun.","","","","","","","","eng","","","","","PubMed","","PMID: 6","","","http://www.ncbi.nlm.nih.gov/pubmed/6","","Humans; Hydrogen-Ion Concentration; Binding Sites; Cobalt; Hemoglobins; Iron; Ligands; Mathematics; Oxygen; Oxyhemoglobins; Protein Binding; Spectrum Analysis","","","","","","","","","","","","","","","","","","","","","","","","","","","","","","","","","","","","","","","","","","","","","",""
"I6S2TDCT","webpage","","","Metadata","","","","","http://www.icpsr.umich.edu/icpsrweb/content/datamanagement/lifecycle/metadata.html","","","2017-10-30 02:01:05","2017-10-30 02:01:05","2017-10-30 02:01:05","","","","","","","","","","","","","","","","","","","","","","","/Users/blakeschool/Zotero/storage/JUF87LY3/metadata.html","","","","","","","","","","","","","","","","","","","","","","","","","","","","","","","","","","","","","","","","","","","","","","","","",""
"2Y7HS98G","conferencePaper","2014","Konstan, Joseph A.; Walker, J.D.; Brooks, D. Christopher; Brown, Keith; Ekstrand, Michael D.","Teaching Recommender Systems at Large Scale: Evaluation and Lessons Learned from a Hybrid MOOC","Proceedings of the First ACM Conference on Learning @ Scale Conference","978-1-4503-2669-8","","10.1145/2556325.2566244","http://doi.acm.org/10.1145/2556325.2566244","In Fall 2013 we offered an open online Introduction to Recommender Systems through Coursera, while simultaneously offering a for-credit version of the course on-campus using the Coursera platform and a flipped classroom instruction model. As the goal of offering this course was to experiment with this type of instruction, we performed extensive evaluation including surveys of demographics, self-assessed skills, and learning intent; we also designed a knowledge-assessment tool specifically for the subject matter in this course, administering it before and after the course to measure learning. We also tracked students through the course, including separating out students enrolled for credit from those enrolled only for the free, open course. This article reports on our findings.","2014","2017-10-31 15:33:13","2017-10-31 15:33:13","2017-10-31 15:33:13","61–70","","","","","","Teaching Recommender Systems at Large Scale","L@S '14","","","","ACM","New York, NY, USA","","","","","","ACM Digital Library","","","<p>Key Notes:</p> <p>Goal is to create a high-quality MOOC on recommender systems</p> <p>Programs vs concepts: can two tracks work?</p> <p>Why researching MOOC's is hard: diverse student pop, lack of information on students’ background,  aptitude, and knowledge prior to the course, non-random attrition</p> <p>Long format actually does work (14 weeks,  longer lectures) and many students preferred it</p> <p>Face-to-face students overwhelmingly preferred  the MOOC approach Better time management Better able to pace learning; rewind; language issues</p> <p>The two-track approach worked!  Possible to  learn the concepts well alongside programmers</p>","/Users/blakeschool/Zotero/storage/4DWWQTBU/Konstan et al. - 2014 - Teaching Recommender Systems at Large Scale Evalu.pdf","","","distance learning; evaluation; mooc; open learning","","","","","","","","","","","","","","","","","","","","","","","","","","","","","","","","","","","","","","","","","","","","","",""
"GS8DKQXR","videoRecording","","Udacity","Feature Selection - Georgia Tech - Machine Learning","","","","","https://www.youtube.com/watch?v=8CpRLplmdqE","","","2017-11-02 03:07:01","2017-11-02 03:07:01","2017-11-02 03:07:01","","","","","","","","","","","","","","","","","","","YouTube","","","<p>Key Notes:</p> <p>As you add more features- the amount of data needed grows exponentially</p> <p>Knowledge discovery -interpretability and insight</p>","","","","computer science; Georgia Tech; machine learning; Udacity; unsupervised learning","","","","","","","","","","","","","","","","","","","","","194 seconds","","","","","","","","","","","","","","","","","","","","","","","","",""
"U843S9JV","webpage","","","Machine beats experts: Automatic discovery of skill models for data-driven online course refinement","","","","","http://files.eric.ed.gov/fulltext/ED560513.pdf","","","2017-11-07 00:18:35","2017-11-07 00:19:02","2017-11-07 00:16:57","","","","","","","","","","","","","","","","","","","","","","<p>Key Notes:</p> <p>Large-scale  online  courses  (e.g.,  MOOCs)  often  contain  a  broad   range of contents frequently intended to be a semester’s worth of  materials;  this  breadth  often  makes  it  difficult  to  articulate  an   accurate set of skills and knowledge (i.e., a skill model, or the Q- Matrix). </p> <p> </p> <p>EPIPANY - combination of the matrix factorization to analyze students’ response data and bag-of- words techniques to analyze course content data.</p> <p>mapping   between   a   single   skill   and   multiple    assessment items in the skill map is called a  skill-item association</p> <p>Our  study  showed  that  using  student  response  data  (i.e.,  the   number  of  attempts  made  on  assessment  items  before  a  student   finally  made  their  first  correct  response)  always  yields  a  better   skill model than using the bag-of-words with item stems. We also  found  that   even only using the bag-of-words, eEPIPHANY always  yields  a  better  skill  model  than  the  default  skill  model  that  is   hand-crafted by human experts . </p> <p> </p> <p> Even   though    eEPIPHANY  requires  human  labor  to  interpret  the  discovered   skill  models  (with  the  aid  of  DoE),  it  is  arguably  still  less  time   consuming  than  creating  skill  models  by  hand. </p>","/Users/blakeschool/Zotero/storage/UGACJAFV/ED560513.pdf","","","","","","","","","","","","","","","","","","","","","","","","","","","","","","","","","","","","","","","","","","","","","","","","",""
"N63K2UY6","videoRecording","","ColumbiaLearn","Big Data in Education 7.6 Knowledge Inference: Q-Matrix Knowledge Structure","","","","","https://www.youtube.com/watch?v=oFSV6-opnws&feature=youtu.be","","","2017-11-12 18:51:43","2017-11-12 18:51:43","2017-11-12 18:51:43","","","","","","","Big Data in Education 7.6 Knowledge Inference","","","","","","","","","","","","YouTube","","","<p>Key Notes:</p> <p>Every item in Q matrix must involve a skill</p> <p>The algorithm on the Q matrix will be run a certain number of times with a different (random) initial assignment of skills</p> <p> </p>","","","","","","","","","","","","","","","","","","","","","","","","","527 seconds","","","","","","","","","","","","","","","","","","","","","","","","",""
"LIDF5KAQ","webpage","2017","","Chapter 5: Handbook of Learning Analytics","Society for Learning Analytics Research (SoLAR)","","","","https://solaresearch.org/hla-17/hla17-chapter5/","Handbook of Learning Analytics First Edition Predictive Modelling in Teaching and Learning Christopher Brooks & Craig Thompson Download Chapter Download Book Abstract This article describes the…","2017-05-10","2017-11-14 01:21:39","2017-12-17 21:56:28","2017-11-14 01:21:39","","","","","","","","","","","","","","","","","","","","","","<p>Key Notes:</p> <div class=""page"" title=""Page 1""> <div class=""section""> <div class=""layoutArea""> <div class=""column""> <p><span style=""font-size: 9.000000pt; font-family: 'Lora';"">P</span><span style=""font-size: 9.000000pt; font-family: 'Lora';"">redictive analytics are a group of techniques used to make inferences about uncertain future events. In the educational domain, one may be interested in predicting a measurement of learning (e.g., student academic success or skill acquisition), teaching (e.g., </span> <span style=""font-size: 9.000000pt; font-family: 'Lora';"">of value for administrations (e.g., predictions of re- </span></p> <div class=""page"" title=""Page 2""> <div class=""section""> <div class=""layoutArea""> <div class=""column""> <p><span style=""font-size: 9.000000pt; font-family: 'Lora';""> Explanatory modeling is a post-hoc and reflective activity aimed at </span><span style=""font-size: 9.000000pt; font-family: 'Lora';"">generating an understanding of a phenomenon. </span></p> <div class=""page"" title=""Page 2""> <div class=""section""> <div class=""layoutArea""> <div class=""column""> <p><span style=""font-size: 9.000000pt; font-family: 'Lora';""> Predictive modeling is an in situ activity intended to </span><span style=""font-size: 9.000000pt; font-family: 'Lora';"">make systems responsive to changes in the underlying data.</span></p> <div class=""page"" title=""Page 3""> <div class=""section""> <div class=""layoutArea""> <div class=""column""> <p><span style=""font-size: 9.000000pt; font-family: 'Lora';"">In statistical modelling, there are generally four types of data considered: categorical, ordinal, interval, and ratio. </span></p> <div class=""page"" title=""Page 3""> <div class=""section""> <div class=""layoutArea""> <div class=""column""> <div class=""page"" title=""Page 3""> <div class=""section""> <div class=""layoutArea""> <div class=""column""> <p><span style=""font-size: 9.000000pt; font-family: 'Lora';"">Applying a learning algorithm that naively assumes independence of the attributes can result in predictions with an over-emphasis on the repeated or correlated features. </span></p> </div> </div> </div> </div> <p><span style=""font-size: 9.000000pt; font-family: 'Lora';"">By determining an informative subset of the features, </span> <span style=""font-size: 9.000000pt; font-family: 'Lora';"">predictive model, reduce data storage and collection requirements, and aid in simplifying predictive models </span></p> <div class=""page"" title=""Page 4""> <div class=""section""> <div class=""layoutArea""> <div class=""column""> <p><span style=""font-size: 9.000000pt; font-family: 'Lora';"">After collecting a dataset and performing attribute selection, a predictive model can be built from historical data. In the most general terms, the purpose of a predictive model is to make a prediction of some unknown quantity or attribute, given some related </span> <span style=""font-size: 9.000000pt; font-family: 'Lora';"">several such methods for building predictive models. A fundamental assumption of predictive modelling is that the relationship that exists in the data gathered in the past will exist in the future.</span></p> <p> </p> </div> </div> </div> </div> </div> </div> </div> </div> </div> </div> </div> </div> </div> </div> </div> </div> </div> </div> </div> </div> </div> </div> </div> </div>","/Users/blakeschool/Zotero/storage/SFISKWML/hla17-chapter5.html","","","","","","","","","","","","","","","","","","","","","","","","","","","","","","","","","","","","","","","","","","","","","","","","",""
"HAA3Q2YV","computerProgram","2017","brumuly","assignment4-brumuly created by GitHub Classroom","","","","","https://github.com/brumuly/assignment4-brumuly","","2017-11-02","2017-11-15 03:16:13","2017-11-15 03:16:13","2017-11-15 03:16:13","","","","","","","","","","","","","","","","","","","GitHub","","original-date: 2017-11-02T15:23:38Z","","","","","","","","","","","","","","","","","","","","","","","","","","","","","","","","","","","","","","","","","","","","","","","","","","",""
"LPXI7C9Y","webpage","2017","","Chapter 6: Handbook of Learning Analytics","Society for Learning Analytics Research (SoLAR)","","","","https://solaresearch.org/hla-17/hla17-chapter6/","Handbook of Learning Analytics First Edition Going Beyond Better Data Prediction to Create Explanatory Models of Educational Data Ran Liu & Kenneth R. Koedinger Download Chapter Download Book A…","2017-05-10","2017-11-21 16:00:48","2017-12-17 21:56:33","2017-11-21 16:00:48","","","","","","","","","","","","","","","","","","","","","","<p>Key Notes:</p> <div class=""page"" title=""Page 1""> <div class=""section""> <div class=""layoutArea""> <div class=""column""> <div class=""page"" title=""Page 1""> <div class=""section""> <div class=""layoutArea""> <div class=""column""> <div class=""page"" title=""Page 1""> <div class=""section""> <div class=""layoutArea""> <div class=""column""> <p>The field could benefit from more focus on developing explanatory models</p> <p><span style=""font-size: 9.000000pt; font-family: 'Lora';"">Explanatory models seek to identify interpretable constructs that are causally related to outcomes and thus provide an explanation of the data that can be connected to existing theory<br /></span></p> <div class=""page"" title=""Page 3""> <div class=""section""> <div class=""layoutArea""> <div class=""column""> <p><span style=""font-size: 9.000000pt; font-family: 'Lora';""> LFA searches across hypothesized  knowledge components drawn from existing </span><span style=""font-size: 9.000000pt; font-family: 'Lora';"">KC models, evaluates different models based on their </span><span style=""font-size: 9.000000pt; font-family: 'Lora';""> fit to data, and outputs the best-fitting KC model in </span><span style=""font-size: 9.000000pt; font-family: 'Lora';"">the form of a symbolic model. As such, LFA greatly reduces demands on human effort while simultaneously easing the burden of interpretation, even if it does not automatically accomplish it. </span></p> <p><span style=""font-size: 9.000000pt; font-family: 'Lora';""> </span></p> </div> </div> </div> </div> </div> </div> </div> </div> </div> </div> </div> </div> </div> </div> </div> </div>","","","","","","","","","","","","","","","","","","","","","","","","","","","","","","","","","","","","","","","","","","","","","","","","","",""
"XJP5YUUG","webpage","","","swirl | Students","","","","","http://swirlstats.com/students.html","","","2017-11-22 02:29:55","2017-11-22 02:29:55","2017-11-22 02:29:55","","","","","","","","","","","","","","","","","","","","","","","/Users/blakeschool/Zotero/storage/8B4FLAQG/students.html","","","","","","","","","","","","","","","","","","","","","","","","","","","","","","","","","","","","","","","","","","","","","","","","",""
"B9KGVXQ7","videoRecording","","ColumbiaLearn","Big Data in Education 2.2 Diagnostic Metrics Part 1","","","","","https://www.youtube.com/watch?v=fGMFYTHhcHg&feature=youtu.be","","","2017-11-28 00:21:03","2017-11-28 00:21:03","2017-11-28 00:21:03","","","","","","","","","","","","","","","","","","","YouTube","","","<p>Key Notes:</p> <p>Accuracy also called agreement when measuring inter-rater reliability</p> <p>Accuracy not a good unit of measurement</p> <p>Kapp .3-.5 ideal value</p>","","","","","","","","","","","","","","","","","","","","","","","","","517 seconds","","","","","","","","","","","","","","","","","","","","","","","","",""
"XRWNG5I8","videoRecording","","ColumbiaLearn","Big Data in Education 2.3  Diagnostic Metrics Part 2","","","","","https://www.youtube.com/watch?v=9PDwRdyb6Sw&feature=youtu.be","","","2017-11-28 00:30:16","2017-11-28 00:30:16","2017-11-28 00:30:16","","","","","","","","","","","","","","","","","","","YouTube","","","<p>Key Notes:</p> <p>ROC Curves predict two values</p> <p>Prediction model puts out real value</p>","","","","","","","","","","","","","","","","","","","","","","","","","723 seconds","","","","","","","","","","","","","","","","","","","","","","","","",""
"XGU4TIUX","webpage","","","Big Data in Education 2.4 Diagnostic Metrics: Correlation - YouTube","","","","","https://www.youtube.com/watch?v=7r3hfJW1gz0&feature=youtu.be","","","2017-11-28 00:50:55","2017-11-28 00:50:55","2017-11-28 00:50:55","","","","","","","","","","","","","","","","","","","","","","<p>Key Notes:</p> <p>Linear corelation = pearson correlation (-1 to 1); high = good</p> <p>r2 = correlation squared</p>","/Users/blakeschool/Zotero/storage/NRSMBZ33/watch.html","","","","","","","","","","","","","","","","","","","","","","","","","","","","","","","","","","","","","","","","","","","","","","","","",""
"YXFV3F3S","videoRecording","","ColumbiaLearn","Big Data in Education 2.5 Cross-Validation and Over-Fitting","","","","","https://www.youtube.com/watch?v=1P34cxpEdKA&feature=youtu.be","","","2017-11-28 01:00:15","2017-11-28 01:00:15","2017-11-28 01:00:15","","","","","","","","","","","","","","","","","","","YouTube","","","<p>Key Notes:</p> <p>Over fit - not good for future data</p> <p>Cannot eliminate over fit</p> <p> </p>","","","","","","","","","","","","","","","","","","","","","","","","","419 seconds","","","","","","","","","","","","","","","","","","","","","","","","",""
"JLWS5ZLU","videoRecording","","Udacity","Cross Validation","","","","","https://www.youtube.com/watch?v=sFO2ff-gTh0&feature=youtu.be","","","2017-11-28 01:07:34","2017-11-28 01:07:34","2017-11-28 01:07:34","","","","","","","","","","","","","","","","","","","YouTube","","","<p>Key Notes:</p> <p>goal is to generalize</p> <p>data is expected to be Independently Identically Distributed</p> <p> </p>","","","","computer science; Georgia Tech; machine learning; Udacity; supervised learning","","","","","","","","","","","","","","","","","","","","","367 seconds","","","","","","","","","","","","","","","","","","","","","","","","",""
